,business_id,compliment_count,date,text,user_id
378,ug_NBv4W_5fZf3hi2h2U_w,0,2010-02-15 02:17:35,Get their woodfired pizza.  Indian food is just okay.  Stay far clear of the chicken wings they are not winners.,AlXx0P-OhUylep0jNi773g
379,ZiD-51ZPmx682EItg6Y3jA,0,2013-02-19 01:31:35,Tuna melt! Nuff said!,5gYF8vCPu6bs7kJ4dIB-9A
380,oNF-vT3PbCcncgQjPKFVeA,0,2013-11-28 05:05:25,The only decent coffee joint in snooty blueblood right-wing sewickley. The interior is aesthetically pleasing.,_ekUMPGWf4QB5uj6yAvGIw
381,2SedpQ674XBqyw3Wq4kyxQ,0,2012-11-02 15:12:04,They only accepting cash today,98S0b7UD-CGBGX0f4LPNvQ
382,dcrL22ant20s1thjdVGhLw,0,2017-06-21 21:42:12,Lousy and overpriced.,Ko6yE7f5bFqGB_80fqrB6w
383,tC-NwTuQGb37uIrZLFRLiQ,0,2013-07-01 16:37:32,"How are you guys so incompetent??? It's the first of the month, you know damn well it's going to be busy. Yet you only have 3 tellers and your merchant line isn't stocked with change?? Incompetence at it's finest!!",BI4jBJVto2tEQ0NiaR0rNQ
384,El4FC8jcawUVgw_0EIcbaQ,0,2011-12-24 22:04:36,Baby lions habitat!,7sNE58P4AvsX6QHE8ypCiA
385,Wxxvi3LZbHNIDwJ-ZimtnA,0,2011-08-01 02:06:40,Lets try my luck here,YslR3U1iwphOFYqvwSZ4cQ
386,M-fXuCV_oncmmNyXDug2rQ,0,2014-06-14 22:09:36,Great sale 70% off and take additional 30% off on these clearance items,LnX7-WmpML5bY6Fzlz468g
387,yQXnr78QZh4KUhgFw_cevQ,0,2011-07-20 05:48:33,Come by in the late afternoons to redeem those treat receipts from the morning and get one ice grande drink for $2.00!  The place is empty.,A0j21z2Q1HGic7jW6e9h7A
388,LZfD1fThijhkNkzv4rUWSg,0,2010-03-07 19:52:05,Girl scout cookies?!,8-c_N_vSkwVieg8sHn_Ppw
389,stbX9rtRIpDF-VymOwHJ8w,0,2011-08-11 08:28:17,Wednesday,o4sfrn1ziZ-7yasx2127xw
390,GHS1rVjO-RMcRB6WJLpCDQ,0,2012-01-01 22:02:30,Maybe i should have lester hang onto my credit card before i get too crazy...,V66QZYkxG6FJ03nvf9SMIA
391,VgSF_jQ8St7A2DhdafRDCQ,0,2017-05-10 00:26:31,"Affectionately called ""The Queue"" by locals, and home to the 2015-16 NBA Champion Cleveland Cavaliers.",0sl4I8R7znWXp_K4A0nZ_w
392,bXxRryuNDa1ZROvIA2J7-Q,0,2012-10-06 17:32:32,Beautiful day in Boulder City...bring your dog and the kids!!!,3nDUQBjKyVor5wV0reJChg
393,lhjUxj7lw5f4oAA8ml3Zlw,0,2012-07-28 20:20:08,Need gelato...,xq1zRJz5VHgEKiCaI51_Gw
394,hHe1mFDxxrtejXHfiysJJg,0,2017-04-27 05:33:51,Pot that melts is never good pot,AX6_NL1_GTM2tcN9jn8mQw
395,YrVoo51-y4jMxpZh-kPRfw,0,2011-10-09 19:16:22,Brunch with the love of my life!,DCb1NHozrcKBKokL7z3LfQ
396,agGJSdMTRrkA6VrYMbC-SQ,1,2014-09-08 21:22:23,Out of salad today,Y8adrWFzckrjuC11aAs9Og
397,F4EwSP2fjntxwiT6AAKsVw,0,2016-04-22 01:01:01,One-star customer service tonight.  Never again.,BA9SDRZGyRcUMxTdUTVhmw
398,OLrcJhNki2C-XzPYNB-BaQ,0,2015-09-09 05:48:35,Awesome Coffee!!!!!,XZTFUoglgrfT-EBWAwKnRQ
399,rnx0KHHTD9Yvr2BWAWwQ4g,0,2015-01-16 02:41:23,So many gluten free options! Even a gluten free fish fry and gluten free cupcakes.,Q1IENmNc6bdDruACmhy4mg
400,VUEbOHYJYcnmjfsnxCitiQ,0,2012-05-19 23:22:20,Fueling up for Mexican night @kinetik!,IPNI0-4Qdv7xENcx8EI5Tw
401,46zwhZduYYqI2pKQyrd1Pg,0,2013-12-14 08:21:52,Pizza & wings. These are a few of my favorite things.,CQm1OAqGQJvtE-B4jQRz0Q
402,uhux2R0hE_tTcKLv3zSmew,0,2011-05-04 23:35:05,Afternoon snack!,t2nPIKI2iy8VG_cfFD0Vmg
403,blU2m56zkJc0SucLnbc4vw,0,2011-07-16 17:07:50,Brunch!,B-eObkICy_LFjMfrUfW6Yw
404,l-Zjik0MbpabQPv-nNp9YQ,0,2014-03-15 16:40:21,"Street parking went early took home apple fritter strawberry zeppela, cappuccino great
Took a Huge cold cut sandwich and Greek salad home for lunch, great bread fresh
Next time  porchetta  sandwich
Guess what porchetta in assorted with cracking skin so good could only eat 1/2. Dinner the rest with salad!",-vfjOBjztq9rOtOK7YMVXQ
405,icsmeOong1Ac5AcwKKuqgQ,0,2014-06-08 06:10:28,Grab the Tamago (egg) burger with a side of Jazz Fries...you won't be disappointed.,Ozmf732ox-TNhfKrjWBXpg
406,ZzEIraKkYkhWqnFu93Vf-g,0,2013-02-20 01:52:47,"Wow that rice pudding is terrific!  And is sprinkled with crushed pistachios.  And ""the Bob""  little pastry is soooo good",Gl9XFtwFgIifENxZKqRSfA
407,2fqHO2vFbcwVV27c_Irm8Q,0,2016-12-06 18:53:16,The best movie theater!,t_uV5QZeKuuiTEEMsGPtQg
408,EeOrrSmqNIoVnLW9kjEfOg,0,2013-12-04 18:24:29,Great way to see the area & it's free.,RuYYtPAdhVjQ6u6GqmgZHw
409,ZdFl7MqnF09dcifG1j7l_w,0,2017-06-28 22:56:22,"Bugs in drinks, beer taps don't work. Takes forever to get service. Won't be back",xSQerJqLmSXuCUATRA86_g
410,Q-fXNh68OldNdotEVEJuhQ,0,2015-09-10 18:52:33,"Good gamer promos, delicious food and cute, friendly staff. Must try!",shYLM4g_3C5LU4Jb7KW0eQ
411,ZP39Z9C9l47QaiiXlRSrNA,0,2017-03-18 23:15:53,The martinis are great,1_fwIUwAC5NEF3uhCXMaHg
412,pJQSdbrtQQVstMUUIICSsA,0,2016-05-01 02:37:42,I don't have any problems here,FiHiGLDPsNv7nzgpUXgKlw
413,8yfNxQH1MOaPorSR_Lmj9g,0,2015-01-26 19:30:38,avoid this place,8LHmg3kR_e1S-8WSxMyCdg
414,D2ojX9bvE0_-aIj9BhdZZA,0,2014-09-07 17:00:43,"The food was much better than my first visit last year. The service, although friendly, was A LOT spottier. So my 3-star review still stands",RTlvmyy3b0EQWZOzJBtojA
415,bZtukyhyV1oVmUU3yRBPbQ,0,2016-12-04 01:08:18,Great lattes and good coffee,zPrnD3FdU7zouX0JhJgOrg
416,p0mrAI9F5obInFizyfc_0A,0,2016-05-20 00:29:53,Great burgers but amazing salads here,nT3oVWhrFsrcqiEbSXB4zA
417,Lhaj-hGoMgw70_vbFW9a9Q,0,2012-08-03 19:29:35,Now open,UXZDRVdx8eJqdqb13Bcfcg
418,Oe6cb42EkFvIWwEIooY-OQ,0,2010-01-30 05:36:09,Italian market salad,zdZNqX4Gr4M7IIDo9lTKXQ
419,N0apJkxIem2E8irTBRKnHw,0,2012-05-28 13:57:59,Favorite place to eat @ The Grand,fAPfgpJo_0xvU98ocYrubA
420,RNi6tW22UMgHwWLAb0mYdA,0,2012-10-07 03:47:51,Holy cow. Literally... The prime rib was a holy experience. What a neat restaurant and the food was delicious. And there is plenty so skip lunch beforehand.,29KnJybaavIMuqTetQZogw
421,sWucpMb_MDdqAthWFFisow,0,2013-02-03 00:02:48,Great Matzo Ball Soup and fabulous desserts!,PRKCvxZWx48sZpw_tLlbpw
422,1bdwB6hxMUnSKF8bCsmuZA,0,2017-03-16 02:55:04,Grand opening special 20% off everything 3/13-15,dsaj_eA71FvpUh49zzKcGA
423,-sAr-LA9TsIdl37UjwBlvg,0,2011-04-18 01:34:33,A little late but better than never :),gru76BjkRY6UQVcw_yAxiQ
424,9h8ufGEG_kUf_H3Lq81veQ,0,2014-03-15 00:24:11,If you come ton pittsburgh you have to try the burgh's famous diner!!!,hj1uOV27vN_3KfD3Qd4dTA
425,Q3BUdZTMw8KRd-3QYtTyAg,0,2013-02-08 01:38:31,Complimentary mushroom toppings,m7z-tX6XDZ27xGhGjnI21w
426,bzI2YREsxDomhVvvaZmcSw,0,2012-03-19 03:40:25,Mmm tequila lime chicken pasta,53hTHxGUy7AC8Oz7BE7-3g
427,Lw9EBaDVg5R36dIE6N2oqw,0,2012-08-03 04:38:21,Two nights in a row...awesome food,Obh34RuSKoIorSY7pEPEyw
428,6fd9EIo9TAFvJLkfC7_qYA,1,2017-06-26 15:42:47,"Better come early , before long cues. They have tasty house sausages.",Z7xuJ9P_rMtBvi4aFmP7zw
429,eJNHwNoCk_hZbK8AeHDZ9g,0,2015-09-03 14:25:22,Love their ribs ..its seasoned to the bone.  I got my friends hooked on it!,84lmIsZzMOX5oKL79Zv2vQ
430,4KfDcE9iU2isFpoaKeDpgw,0,2014-09-03 03:44:24,My favorite library in Vegas! The hours of operation are posted online monthly.,ROXy7nX-Z1S11btsuQRl8g
431,e5Qw3r7mkwPLcdDzZzTeew,0,2013-02-10 21:25:32,Great sushi at great prices! Love the cracked out edamame!,Sme_0jk0mJPWIMjGzKqBbQ
432,htYiZKFOaiThBmPOAdT5PQ,0,2017-11-30 03:21:38,Select $8 car wash when you buy $10 in gas. Your car wash will be free (check receipt for credit)... just punch in code at drive thru wash! EASY PEASY and FREE!,2eToXGVa0Fzti8drf3HaoQ
433,JUFIUjadF1rCMQJ01VOMow,0,2015-06-08 01:44:39,"Based on our 2 experiences and after speaking to many locals, this is not one of the 'better' sushi restaurants in the area. Small rolls, small selections and not always the freshest fish",2CALR5iCk-ZkyFcKJ27DUA
434,Xg5qEQiB-7L6kGJ5F4K3bQ,0,2017-09-21 17:52:13,Food is outstanding and service is even better. Great place a true treasure.,dfs7U8cJpU-OqvHbvhWWUg
435,AbRIvxhf1rYH7dBjJZgyPg,0,2016-11-23 01:55:06,Amazing staff. Always friendly and on time.,Fbb0xtV33sBhrWD2B6L3SQ
436,azxeH9W14hzFnZyuOm8JdQ,0,2012-10-11 20:34:39,Small but packs up really quickly...hey its the airport,CVIhVN2g4oUhLfgimO1iDw
437,IlGba2NVZoQH28zEUZAX1Q,0,2014-06-19 23:57:59,This place does not exist according to the yelp map marker. I googled the address and it's clear across town on the other side of Henderson.,sELpZpITOy9abQB3YY2Ugg
438,ZFyJ83LJkkO1dP82kzXKNg,0,2012-06-06 18:10:41,Ask for Jackie she rocks! Best time ever!,DHUfDrzWi0rTSel-14RLoA
439,7qHU_Zh5qEJP3DaaBHqWBg,1,2017-05-21 17:42:42,They are no longer offering their meat options and switching over to a vegan only menu,CQ67NJigSe5-uBDX3b_CUw
440,mZK8IBkMFzOX2UmA7_BylA,0,2014-03-23 16:02:18,Quantity quality and value!,gmZn_IJHanPYxLPJVComGQ
441,xTBhu4RsILyo82lVPBMG8A,0,2013-05-23 04:04:28,Open late.,quH7oYf3C-_klKjP-cklCQ
442,BxKe9Xt_fN6qBzrTofHuEQ,0,2011-04-28 02:19:43,OMG insidious!!!!,MbKhZ5jip0OVZ_4Lx3S0lg
443,0nasnxiDSVmFmh7s9sxBAQ,0,2012-08-04 01:14:55,As basic as basic can be,6Nk8WX1STMTEuKjmRlrh6A
444,JfHXzulF6yIKgA22YYPedw,0,2010-11-21 00:41:36,Cindy and jon's rehearsal dinner and my first visit to Aunt Chilada's!,dIIKEfOgo0KqUfGQvGikPg
445,tJITTrheGN4ZZ25xMqWwnA,0,2011-07-26 21:41:45,Ewww. Gross old people food. Denny's is better and that ain't saying much.,unY-F7AsYkQDvILMpd3jPw
446,vOdiLz0dTiyHmkbv61HYGQ,0,2015-03-18 12:12:39,Nope.,X0OtLyvbo21FUSNXn9qAmQ
447,8YJOMfdnk42v3PvpkDxJGg,1,2014-09-19 03:14:18,Sam's the man!!,y3FcL4bLy0eLlkb0SDPnBQ
448,r7IvPMyza853adkAvi1RNQ,0,2014-06-05 03:09:12,So for the service in the restaurant sucks!,QzebJb11d4AIIVi9kCekqw
449,li99_TrLe0pyXZRBoOqkBA,0,2018-03-20 23:42:14,"Notice posted reminding people that they don't sell any tickets, tokens, or the TTC Metropass inside & that they do not provide change. Exact change required. March 2018",sYl1niCXXzFbyI4UPouM3w
450,RtnTbhWYw4QjKhoTBV37OA,0,2014-08-24 03:10:08,"Fun atmosphere, Summer Salad & the Jumbalaya had good flavor. Very enjoyable.",VLGMvHs4TKxyQboYv9Jr8w
451,HD4JDFoc_htq5VYESJT8gw,0,2012-07-28 19:31:21,Wings with pops. His first time here.,d7ADBopz58fcAi3iBMhchg
452,gG9z6zr_49LocyCTvSFg0w,0,2012-08-02 05:59:44,A gave,6OsqYvCScSAcqP9jQcOAlA
453,HumV0E5AE0MmyusDpd0b7w,0,2014-06-05 17:50:40,Carne asada burrito double tortilla!,0aX2DOWKV54jaQM-Vp1PvA
454,SeQlCrKvyM2j8m_75gtouQ,0,2012-10-01 13:15:54,Great Farmers omelolet,QI6OZfsflX-ZsPeaXAwSMw
455,y4ETe3DkcIjjr_eyeg5U5g,0,2014-03-20 04:24:06,amazing vegan comfort food for cheat days,zgV0ZroIF956gw4cul8MHA
456,VA95qAV2PRH9gtTi2Vfv4Q,0,2017-03-19 16:49:37,"Mushroom pasta, Mafalde ai Funghi, will be your regret if you do not try this!",i1Z3NOdcuY-JuP2fJEsQbA
457,z_DGwPyUPgCk5Q7-WunsbA,0,2013-05-23 21:25:00,Space is limited. Service is pleasant. Food is excellent.,9iWKo3AbBdkvVqKiTKwDLQ
458,i7mun1-ScNG9KGfI3ehcnQ,0,2012-10-11 16:27:07,Minute clinic hours. Mon- fri 8:30-7:30pm. Saturday 9-5:30 Sunday 10-5:30,VbfaQcyRqSZ0rGvhgg-3Fw
459,QTH_XGh4rWYdd0fTW-tUDw,0,2011-12-30 19:49:24,"The food has been more hit than miss as of late, but these stores are in disrepair.",XPNiTbrKL7f0_6L0lrbZlg
460,CB8_BQHSOkQiTCl5em9Xvw,0,2016-12-01 00:40:03,"Brand new, cozy little pierogi place!",AOyx5wLOfgYBKoZ6v7SHlA
461,iob-hWxzVOsZxC5sh0EdHA,0,2013-08-17 17:56:03,"First time dining here, and the salsa is amazing!!!",R9XWVIIn5pI7ZGf-NX8ukA
462,Y4sjU-nFzFwoHsBFK3jDIQ,0,2012-03-26 16:53:34,Smaller than most TJ Maxx stores.,UYcmGbelzRa0Q6JqzLoguw
463,uX2hjcnQIszqyNKqPP9e1g,0,2017-11-05 21:23:09,"OK yall. *BUFFET* works like this: pay in parking lot, you've got 3 trips for dine in, 1 med crystal plate to hold food, cake stand holds bread, cucumber lime water and tea the length of the bar",r-zUIQPaHzvIyL93wQaoiQ
464,FQXu06x5D5huxPbK04DItw,0,2017-02-22 17:29:40,Triple Tacos - Gladiator,6tbXpUIU6upoeqWNDo9k_A
465,OTir3s3_WkoBP1MCkMf4Mw,0,2015-05-26 14:37:50,"Hands down, best nail salon on the east side.",_kpe0jAY6ShwvtZPXGI1TA
466,O85iR6k-pDHpRFwXlppdSw,0,2012-01-07 21:39:16,First time here and it's a very promising place. Tried the Hamburger Steak with Sunny Side up and it's pretty bomb.,RDtoAKtFjv632JvVtguMZw
467,YO8sWa0wYChH6DQWnE6NFg,0,2012-10-05 18:52:23,Latest breaksfat ever,nOcP-0PIg4REFX4JeR49aw
468,uOWWk2duBzNao8fiQFWkJQ,0,2017-03-12 19:47:55,Great lunch specials. Really good sushi!,_CQetImJGo97dAIM0fjsSA
469,KEWfF9p7SmABOl-AY0fJdg,0,2016-11-16 21:37:33,Bad!! Tools they use aren't sanitized. Very harsh with your feet,-o8qqlFjEDq849SQEoqhcQ
470,e59uNE07Gf-yrIl4rX3KZw,0,2015-01-17 19:22:39,They are open Saturdays!,eWD-kLqwCf1MaZxvO4yDLA
471,7dKIMvsTQI6zO-NYdRmrwA,0,2011-04-22 23:41:06,Friday and Saturday All you can eat Cod and Chips $10.95,exib1tEtfch9DumbyanNCw
472,2pOE6yvSNjJ7RNV5in_nLg,0,2016-01-10 16:46:06,Busy Sunday crowd but beginning to thin out. Next round will hit in about 30 minutes when the Churches finish their 11:00 am services.,GGTF7hnQi6D5W77_qiKlqg
473,25Qa4NoliJ75F_6u3nqZhw,0,2011-07-30 22:00:27,Making room for all the junk I'm going to indulge in this weekend :P,y1F1QhvHlL5RMBU7dpYK1Q
474,CgnHLwWbteqb8qxcZgBLyw,0,2011-04-14 02:53:17,Nice pretty Thai BBQ. Service is good but smile would you please. Portions are much smaller than the L.A. Thai bbq.,zh7sSdnM3CefK8RBRWahZQ
475,JmI9nslLD7KZqRr__Bg6NQ,0,2012-03-23 04:47:58,The local time is 9:48 pm and it's a nice 77 degrees.,w3xqft4amacLrtswH7mrzg
476,8mIrX_LrOnAqWsB5JrOojQ,0,2013-08-30 22:54:45,Twilight Zone has four flippers!,7Oe6ikklTjVBbEFw9emLcA
477,5q3KXqawYgu5hd11mCXlVQ,0,2012-11-17 00:01:37,Sake bomb!!!,yZdfEKXGAnEISaSMYTRPuQ
478,vukjcARwa7rWfwD3Z4xTOA,0,2017-06-14 21:33:37,"It's freezing inside. Outlets and usb chargers all along the walls, but limited seating. Parking lot.",vxdyFpyiWkbSOYHefhB_dg
479,veUZ0PzegME87yvicpAWuw,0,2012-10-06 16:21:04,Fire roasted burrito is delicious,yis0tDX83YnFLzUbKZ_KFg
480,j3IEZP4nQAt7fkxmerLMbA,0,2013-08-30 23:24:37,Love me some Winghart's... One of the best places in Market Square.  Everything is awesome!,hLVq7VSJBHZwqurwWoCmpg
481,-Ht7HiGBox8lS1Y8IPjO8g,0,2011-08-09 03:59:42,Open until midnight every night!,-fQPzH-e-ubDIiLQhybEjQ
482,-xkEf2T_2bM_n0rMmH-svg,0,2015-02-20 19:57:09,Best sub's... Hot.. Lots of meat....,nwQ_nIxVWYByTTqXiCQLAA
483,7_n9hWnaWKRCUOLNPlBLwA,1,2012-10-26 23:30:14,Bring ya sweet tooth :),6ZC-0LfOAGwaFc5XPke74w
484,QwV5P0M3R4ANjOOfGWVYqg,0,2013-08-25 18:35:43,always Great service!,uSPxEx51U4P4nipshGquEA
485,riM-pBsdqRRVXtAVbLfsxQ,0,2013-06-06 07:09:44,"Very good pastrami sandwich. Like everything else, way overpriced.",3uPAF2-YwiTUN5NvVH6pIQ
486,7ty7Z2v85BW_MNwuYf98cw,0,2011-04-19 01:07:41,for the love of volleyball!,bTTZzC8RvTxTOeGMvJ5icQ
487,ymtJtXwsJUClLNDepV1piQ,0,2017-10-05 02:13:34,Shrimp cocktails a must,kbfpED-6FURIsNlsAXqc2g
488,EwxhzR-VghhMsRObXLMitw,0,2017-11-18 03:45:53,Love our little local diner. Awesome breakfast and lunch!,wdusIzW69B9m8FUszNUFnw
489,auTNigMttjBBTj1MNxOeFQ,0,2013-12-05 20:00:37,"Finally went in for dinner. Lamb Bhuna was delicious. A little pricey at 20, but it was enough for lunch the next day.",Ad-v2Z4vvuzxZxbpywIm0A
490,-n1g9MdeG46v1-gzZ4ldvQ,0,2012-10-28 22:29:33,Receipts have a survey for $1 off your next visit,RJVpaFHx3MwynTM8TNjz0A
491,eHXUyMf64ynMzHaf0LdGgg,0,2017-03-22 19:52:10,LVAC members get 10% off. Didn't realize until after I paid,M4uGs-0Fskn48t9icYk_Tw
492,vy4LdinV671_AXC39u2sTA,0,2015-05-29 20:37:16,"Not the fault of the establishment but, the parking lot sucks.  Park at the far end to avoid trying to juggle around pedestrians and the tiny spots.",iBWUDFSusyGVcXcWmnmcWA
493,e-H0oSN67qs3y45_AGAOQA,0,2012-10-29 23:52:12,Free car wash with 8 gallons or more.,uG35h72BAMutvXAWdRpqCQ
494,01fuY2NNscttoTxOYbuZXw,0,2017-11-15 21:32:24,"Check to go orders before you leave! I dined in & also ordered a Nature Boy Ding Dong style to go. When I got home, I saw that I had the burger with peanut butter & sriracha on it but no honey-cilantro slaw, not even in a separate container or anything",RTlvmyy3b0EQWZOzJBtojA
495,NVFj_QC7fkBMLbau-6P3hA,0,2013-02-03 18:10:30,"Open space, cool environment. Happy hour isn't so cheap.",spelWSmi8FWYn5JD3_hYNQ
496,60zmhS-MTHrhKIXxhSWJ4g,0,2015-06-20 19:20:15,It's funny how I can order the same thing and get charged two different prices depending I suppose on whose taking my order.,XPNiTbrKL7f0_6L0lrbZlg
497,EowvCBMYDsQLd4Aev6Q0kA,0,2012-01-07 11:56:20,Cardio = stress relief (here's hoping),xEQ20W2KZlAXod5qHhkG9g
498,24t7-XcaR6yJi_20CPoB2Q,0,2013-03-02 00:20:21,Lenten fish fry is pretty good. Nice addition to the menu.,ZH2BsTXtOrzgNLFGDFsogA
499,BzqwAx_KlRPAMGXw1xHXag,0,2013-05-29 19:20:37,"The hummus and tabouli here is amazing, and comes with fresh, piping hot bread! So good",A2jvkL3yskY_C6zFkmAqiQ
500,c5TOGBUCCUUNBPM7h_KbmQ,0,2014-06-05 00:33:03,Fish tacos,aWXGwath_dSGPwNdFiy9BQ
501,Ef5P6C2yHAv08FPif5Rdtg,0,2018-02-26 22:42:05,"Wonderful food, nice atmosphere and fabulous service! Did not disappoint.",DSwT6fBYtYFe_xQzgErfTw
502,_guNmxJd4Ep6S3pBZdAjGA,0,2010-02-20 17:20:26,The inside market and coffee bar!,UyuWAvDcLp4zU1Wfc1PNXg
503,bsauQzwixetBDjA7SqUlVA,0,2010-01-17 14:55:08,Wondering if foursquare and yelp might get together so I'm not compelled to check in on both?,hg4AyAMgmQGO2tx6kjo8yw
504,mGgzEpWVNnnpJuv4xrsieA,0,2011-04-11 20:48:34,"Google Maps is off slightly, The Great Indoors is near Lowe's.",A0j21z2Q1HGic7jW6e9h7A
505,GXdnO7m8X4tjVl7MXHgN4g,0,2011-04-16 23:35:09,They only play 70s and 80s music vids.... And lots of Michael Jackson!,JHFuMHQBLuQ3TtkWwx1bmQ
506,kz5UANVmPxpllcoLnZBNhg,0,2012-03-16 22:21:43,Great deep fried Wallete!,UzoS3zaeg_1nksyMpLUARQ
507,AcjO26DmOhqWlfo2s5DUow,0,2016-08-04 06:06:40,Kitchen closes at midnight.,FkiAB75VsciCt76Bo88aSg
508,L2p0vO3fsS2LC6hhQo3CzA,0,2016-08-14 13:01:51,Not really impressed. Plain and bland.,5g0nZvGD7fL-lcYqe3yOSA
509,PmpIoK_i_-xz8RUsJT1kGQ,0,2013-02-04 20:31:26,Expensive!,TQ9A1LVp6z-fIc494RsLDQ
510,M1viPr2C232cofWgtjKTgA,0,2012-08-06 16:53:46,Awesome Music Mondays!,EC5TGpxONfz4IZIjML0DpQ
511,lrfbOC8cbxc4NsguFeSjmw,0,2012-01-12 01:18:28,Veggie run!,-fQPzH-e-ubDIiLQhybEjQ
512,mXA-585FRMGz-FhdGRcqtw,0,2011-04-12 23:18:55,Discussing mis-interpretations on 1st dates,vWUj8ed8ojO8CctKP-mwxQ
513,npWIa3dIPEV1MTaZNq6AUA,0,2013-02-02 19:20:41,Lately I'm all about the spinach salad ( dressing and bacon the side) add a beautiful salmon steak on top! De-lish and healthy!,oWxy_YR6n2w8e9L00hxhPw
514,YIYE7Zk61McLaekLFluzTg,0,2016-11-20 19:18:53,Arrive early!,XB3jLxGXzD7euz3cGKdkMw
515,VbD412ssoCtz6RklpRtLug,0,2013-06-09 07:25:09,Fun place.  Cleaned up with new management.   Nice now.,SR1pPOjWNV7Yi_uYEuMeHw
516,DgsqQubd1oxl2vUnLMPXSw,0,2015-01-22 02:53:10,Très bon petit restaurant. Pas chère. Idéal pour couples.,hEI4dTflQikUTIjvY66ZCQ
517,fW7SHgmidc32kHSoyLTM2A,0,2014-03-15 02:40:24,Home style cafe,9bZRfbCsuqatVXJzbYSrzQ
518,2zBCxn7_jHcfxoSjBdHJ3A,0,2014-08-29 15:07:51,Best chai latte I've ever had! Always keeps me coming back!,F91EIOvWRkQL3Pn4AMGSdw
519,tzCjS9IvtPBDMnFeXlvQBA,0,2016-11-15 23:03:37,Min 20$ for visa and 5$ for debit,YKm-0aMn46Yi0Re2lN1XRQ
520,Crisy-zNv58ItIwPEBb0Cw,0,2012-10-29 17:58:16,Checkin online and then call and ask wait time,pLhOSYMV-d2H8lWI74msEg
521,3gdjVkNeUa9piW9H708Aig,0,2016-04-23 23:57:31,Toronto's no. 1 fish & chips place. Ordered chowder soup and halibut.,rze0JMnOZNEDVDOzJ0E4Yg
522,LNGBEEelQx4zbfWnlc66cw,0,2010-11-26 23:51:33,"Be prepared for at least 1 1/2hr wait if you arrive later than 5pm, even on wkends and most wkdays, select beer and wine included, unlimited",77lef7kKkoOVupY-7AmieQ
523,sDT7CvVLsPG1JizVddhxzg,0,2012-01-16 23:19:10,Another yummy pho spot!,fNLg_HsUFyK4hQIYa4yecg
524,wWuGa3OOQJro_XGe-GKBXA,0,2016-01-16 02:37:16,Closed Jan 10-17. Machine says they take reservations after 3pm but no one is picking up ???,QzXS25_FwIUrYTyDMZkUQA
525,MBsIf01fcA8Vy7vCMMKf2A,0,2014-08-29 21:07:20,Great atmosphere! Delicious food!,N8KY5W3UXAZrAGMYO2IDFw
526,GnFvPN1sCMbho2ItzuPemw,0,2017-06-30 17:41:52,Above all my expectations,wTQsQ9cJtbAkkJRC_owWbg
527,4k3RlMAMd46DZ_JyZU0lMg,0,2012-03-18 04:36:58,Quick break from drinking,PII-EwUDv1At8fUlNa1EKA
528,M8XKncNfA4uw6tEOFySswQ,0,2016-11-17 03:53:33,Great BBQ and amazing service !,A4bpHuvzaQt9-XAg8e9Msw
529,2TFmNewkeZVUXXrHjfHPAQ,0,2011-07-17 22:09:01,I don't think they sanitize their utensil's here :/,gNLc1atcn7jw9jxvHbDvKw
530,iblGI3crNkCheh75-XceFw,0,2012-08-08 22:04:32,Melting outside the store is air conditioned!,kxbEjMA9_OxoTQWWairVqA
531,m1BDEL9C4GsG-0FmAp5P8A,0,2016-09-30 01:07:05,Love this place. Awesome food! Always a good time. Mike and Lori are bomb dot com!,GFQcUUwFUNTeumYzKllSQA
532,EXHjecbVLDDH1UP-aoUcWw,0,2015-01-20 20:05:09,The drive through is SO useful.,QTsB8VtGe46nUbMAZd87uQ
533,JWsq_5AX1vDi-cG7iMJQCA,0,2011-07-31 22:22:49,Amazing selection.of.protein and veggies...great sauces...very friendly too...love it,rKOVduk_kQpoIiom5lbBAQ
534,I9UGWTbalIJovULbb3fzFg,0,2013-12-20 22:41:30,Has a drive through pharmacy.,UG4EKu13JRwzRix6ESINdg
535,Dqzkdf0sz8lm9AFjfsDmIw,0,2014-06-08 00:50:02,The steaks are great,9PZKQuLC5lUs0rJBbWOvjg
536,uO-jz7dBD1pzu17V_RIVLw,0,2015-01-25 04:15:12,El dinner.,WJKocp9RE0KatUwh3_DkGg
537,21OKzzW5jPsdhAa9tt19Cw,0,2017-11-17 16:58:00,Awesome service . Kamili at the front desk was awesome with all of my questions.,wKi8mawLDjluM6j3noY53g
538,1pE3hc4Y13X2wCjhhi1e-g,0,2015-01-20 02:11:39,"If you're going for lunch. Go at 11:30 to 11:55am! 
You'll beat the rush!",KmHtoogKhK-ID7FWGOPvag
539,wXXqG4igJeJwL9o5sjyMXQ,0,2011-10-01 22:31:20,Its all about The Guss...,OHK6Ic_73DqIryviNe88eg
540,82YGtjc5KKikNiqBZ33qzw,0,2013-02-14 01:27:04,One of the best late night eats in town!  Open till 2am everyday!,eZZyuJDouIg4p-GYB3PV_A
541,qVO3l9Q0-KVQE7W9JL9ePw,0,2011-07-17 20:12:29,"Lunch time on a Sunday, good food and no lines. My kinda place!",PcBKCHMhV0pxmYjzGUKmYg
542,Q5sn7sP6v_lk3pxn0xVIlA,0,2017-09-25 19:56:46,Simple order screwed up.  No bacon on a Bacon Cheeseburger.,-PHC1ulwHkY4LEmMqmFwPg
543,pYu6GDIfdK1RfwgUKeeDYg,0,2018-01-14 20:19:09,Always good food and great service!,i6w0VfTvvvbPk6Rj2gsBdw
544,kHpXJ2vciumu2KhNHg0hYA,0,2012-07-29 18:23:22,Hour and half before the game and this place isn't packed!,QtIYPhvYJ3Qr7Io0rbh_5Q
545,5qyVOOsTxMdEByXVkH6LQg,0,2015-05-23 01:33:35,"Love the service here. Mandy, Ashtyn, Cheyenne and Mikey are super friendly and efficient. If I'm gonna spend $$$$$ on coffee, I'm spending it here. Lol. Great crew.",75V5I6xdxQcSK9dgZEjhLw
546,BKtkkcAf_sa6Kk99VIDnog,0,2016-04-23 20:14:57,I trust these ladies to alter all my special  occasion dresses for work and social functions.,2ne7r8bYdmMfzEop04tuEw
547,KUbCQ2ah__c5x0q_6b4oTA,0,2012-07-23 00:10:50,Coctel de Cameron!,QFYT4jsU_MYEjBIhvHNQGw
548,-_LSXPW6JcG0SBcW58H-ag,0,2013-02-08 22:51:39,Snow bound Toronto! Where better to finish the day!,EUiqHCwN2SCYOkQ5PpBJZQ
549,JmI9nslLD7KZqRr__Bg6NQ,0,2012-07-30 02:14:52,This time it's me sending my hubbie off for business travel.  :(,YdS7NVnEhK0gTypX2kMc9A
550,svT1TdTgTd4k4-utMCQU8w,0,2018-01-19 02:44:30,"ESB - smoked pork bucatini, tavern burger",6oJzbP6dqPYoaSuCNKaITw
551,PJxqFL-xUmUaCe2STc5VRA,0,2012-08-05 02:24:19,Stale ice cream !!! Blah,waDvmAl78R3Ke5Ube5cXkw
552,aBLx9JlAMq_AuW6VAImSwg,0,2013-08-31 19:47:11,Interesting menu. Happy to see the variety of health conscious choices.,R9XWVIIn5pI7ZGf-NX8ukA
553,-yWvniZVC6TjhnnptXRVrA,0,2013-12-30 21:43:33,Extremely nice helpful people.,SBnmBbp_2em6cdA7z0-duQ
554,dEi4_bO8ydNHgcRNKV8q6g,0,2011-08-02 15:11:09,Core class,RUZdkgTIUDZViTBXeCbrjg
555,NwVj3tbEcR2F8fbrcOEV0Q,0,2011-02-26 01:11:46,voltron!,6zhNCfVLH6Z_3CkVcTYbDw
556,pWD-7GmdEJWBWxEk8QMOGw,0,2011-10-10 02:08:11,Stupid air,w8q1hum7FsGb6hb9T_2j2g
557,dEh3Su-0GWDSQZYRltA6mQ,0,2013-11-21 02:23:23,"Get there early and bring your own reusable bag for your shopping. Great selection of local produce, honey, fresh breads etc.... lots of fun & lively atmosphere.",uSl8Xx13jwNm9wqxy6QpOg
558,uW6UHfONAmm8QttPkbMewQ,0,2017-02-04 00:17:03,Check out Island Flavor Market next door! Selling Hawai'ian kine grinds and snacks you can't find at Walgreens ;-),825Ol4rTvAZnUyFMke37jA
559,q5thDspap5iM7zwefSQh9Q,0,2015-02-07 14:47:31,"Get there early, you'll be in and out in less than 10 minutes",uT-yzDkY79szXYNWk7zDzQ
560,eduRavkml8awmPachSZXuw,0,2017-11-19 05:50:59,Make reservations if going on a Friday or Saturday!,DrftCOvq0Inf6fxUuuw55A
561,-ed0Yc9on37RoIoG2ZgxBA,0,2012-04-25 18:33:41,Got really crowded exactly when it opened,JRYKceaF35Lo2QQLOFbjpw
562,ccUQ03cxpAtSlEno1BKS0Q,0,2014-10-09 09:03:10,I'll probably drink 1 or 2 a day till I finish the 12-pack.,WALNtcSZlONK4Yj-o3pzKA
563,I3dQmMkfqMsThMAuqIkooA,0,2014-03-30 14:02:57,"This location is super busy around lunch, so plan on waiting a while.",ACwN3HGetqPVhAgGKzdnsA
564,59OgPGGzKFYqwSG_U06kuA,0,2011-07-22 02:00:08,At the International  yelp event,uRcZURC3ituvPT0en9l3xA
565,Jf5etKG_Sc3Xe2dcIUvWZw,0,2016-11-18 23:47:52,Veterans don't forget to ask for your discount. They don't tell you about it even if you are wearing a veterans hat.,80ddx3lGxwrEu8hJYV0AIg
566,vEOBXFIO6jd5sWRw4_Y5eQ,0,2016-05-06 01:28:23,"Frappuccino happy hour (50% off) 3-5pm through 5/15/2016, or 3-6pm if you pay through the app",g9LUvEAloT5BZNrvkqqAOw
567,cHdJXLlKNWixBXpDwEGb_A,0,2010-11-29 01:14:54,Don't stress about the health inspector's report: the snickerdoodles are worth it!,j7nr4cRMxxgenc_ibg-Jcw
568,Xs2iTWxbczvfEapAFH3cyw,0,2011-07-17 16:13:20,"$4.99 for 2 eggs, rosemary potatoes and toast.  Filling and good!",LwSU7fthwBZKI9o4vS0dAg
569,UNI1agsPX2k3eJSJVB91nw,0,2010-11-22 05:22:48,Shrimps and crawfish. Quite a crowd at 9:30 on Sunday,5wT0vDycEzgq95yVCZ60Aw
570,tA5mqEP68qjbTFK9c14D7A,0,2014-06-18 05:21:35,Been driving by this place and finally tried it.. Appropriately priced and a few choices for the hot pot.. Enjoying a jasmine green tea with my soup.. Definitely coming back for more!,yMT85uDGS14PbjZw-Y6v3A
571,A0X1baHPgw9IiBRivu0G9g,0,2012-11-02 16:50:45,Best croissant sandwich ever!!!,erJ1HQwavgZx4996SMIxrA
572,Wc7Hld-DTJbss8CndeIylw,0,2015-05-26 00:04:14,Beautifully decorated!,mj22XHVEWOe-mRh7GFuD9Q
